{
  "schema_id": "orgsmith/baseline-summary@1",
  "slug": "meridian-actuarial",
  "policy_version": "1.0",
  "config": {
    "k1": 1.5,
    "b": 0.75,
    "top_k": 10,
    "tokenizer": "[a-z0-9]+ over casefolded text",
    "tie_break": "ascending share-relative path"
  },
  "scores": [
    {
      "retriever": "filename-only",
      "split": "core",
      "questions": 40,
      "strict": 0.0,
      "precision": 0.3369,
      "recall": 0.7147,
      "f1": 0.3384,
      "recall_at_5": 0.4637,
      "recall_at_10": 0.7147,
      "mrr": 0.6125,
      "ndcg_at_10": 0.5927
    },
    {
      "retriever": "filename-only",
      "split": "distractors",
      "questions": 40,
      "strict": 0.0,
      "precision": 0.3369,
      "recall": 0.7147,
      "f1": 0.3384,
      "recall_at_5": 0.4637,
      "recall_at_10": 0.7147,
      "mrr": 0.6125,
      "ndcg_at_10": 0.5927
    },
    {
      "retriever": "filename-only",
      "split": "noise",
      "questions": 40,
      "strict": 0.0,
      "precision": 0.3369,
      "recall": 0.7147,
      "f1": 0.3384,
      "recall_at_5": 0.4637,
      "recall_at_10": 0.7147,
      "mrr": 0.6125,
      "ndcg_at_10": 0.5927
    },
    {
      "retriever": "filename-only",
      "split": "full",
      "questions": 40,
      "strict": 0.0,
      "precision": 0.3369,
      "recall": 0.7147,
      "f1": 0.3384,
      "recall_at_5": 0.4637,
      "recall_at_10": 0.7147,
      "mrr": 0.6125,
      "ndcg_at_10": 0.5927
    },
    {
      "retriever": "bm25",
      "split": "core",
      "questions": 40,
      "strict": 0.0,
      "precision": 0.3808,
      "recall": 0.6556,
      "f1": 0.3976,
      "recall_at_5": 0.5607,
      "recall_at_10": 0.6556,
      "mrr": 0.7458,
      "ndcg_at_10": 0.6903
    },
    {
      "retriever": "bm25",
      "split": "distractors",
      "questions": 40,
      "strict": 0.0,
      "precision": 0.3826,
      "recall": 0.6501,
      "f1": 0.3948,
      "recall_at_5": 0.5579,
      "recall_at_10": 0.6501,
      "mrr": 0.7458,
      "ndcg_at_10": 0.6866
    },
    {
      "retriever": "bm25",
      "split": "noise",
      "questions": 40,
      "strict": 0.0,
      "precision": 0.3808,
      "recall": 0.6556,
      "f1": 0.3976,
      "recall_at_5": 0.5607,
      "recall_at_10": 0.6556,
      "mrr": 0.7458,
      "ndcg_at_10": 0.6903
    },
    {
      "retriever": "bm25",
      "split": "full",
      "questions": 40,
      "strict": 0.0,
      "precision": 0.3826,
      "recall": 0.6501,
      "f1": 0.3948,
      "recall_at_5": 0.5579,
      "recall_at_10": 0.6501,
      "mrr": 0.7458,
      "ndcg_at_10": 0.6866
    }
  ]
}
